{
  "$schema": "https://recursive-dev-loop.dev/schemas/approval-decision.v1.schema.json",
  "schema_version": "1.0.0",
  "decision_id": "dec-e2e-run-after-20260829",
  "request_id": "req-e2e-run-after-20260829",
  "action": "send_data_externally",
  "scope": {
    "kind": "data_transfer",
    "value": "3f188755da07562ac0cbb833e5e06292ea155d8c8f2cd4f0bb1b1c6175fee0cb",
    "sha256": "15027e146067e461674c916e3b02d77ee00d087361a46bd0d5c203606fa6a54b"
  },
  "decision": "approved",
  "reviewer": {
    "kind": "human",
    "id": "haochuanzhang"
  },
  "decided_at": "2026-08-29T23:39:47.000Z",
  "expires_at": "2026-08-30T05:39:47.000Z",
  "rationale": "Operator-approved after-batch of the closed-loop e2e demonstration: all five tasks re-run with the same model and grader, after the human applied the proposer's skill rule and the diagnosed prompt-instruction fix. Scope binds the updated prompt manifest exactly.",
  "evidence": [
    "repo://benchmarks/tau-style-workflow/run-e2e.ts"
  ],
  "candidate_sha256": null
}
