{
  "$schema": "https://recursive-dev-loop.dev/schemas/approval-decision.v1.schema.json",
  "schema_version": "1.0.0",
  "decision_id": "dec-zai-passk-20260831",
  "request_id": "req-zai-passk-20260831",
  "action": "send_data_externally",
  "scope": {
    "kind": "data_transfer",
    "value": "95a60190fe83c5c523e80124f3e5cde2e66f17a61bdb6bc8e080551cecd882cd",
    "sha256": "ba6d76a3b4dcc8698118eaf7bc9bc362ddde11990db966672f335a2a329bdf3a"
  },
  "decision": "approved",
  "reviewer": {
    "kind": "human",
    "id": "haochuanzhang"
  },
  "decided_at": "2026-08-31T02:14:45.000Z",
  "expires_at": "2026-09-03T00:00:00.000Z",
  "rationale": "Provider matrix: zai/glm-5.2 with the v3 candidate skill and issue_refund=unknown faults. Issued under explicit operator delegation (session 2026-08-31).",
  "evidence": [
    "repo://benchmarks/tau-style-workflow/PROVIDERS.md"
  ],
  "candidate_sha256": null
}
