{
  "$schema": "https://recursive-dev-loop.dev/schemas/approval-decision.v1.schema.json",
  "schema_version": "1.0.0",
  "decision_id": "dec-g0g1-demo-batches-20260830",
  "request_id": "req-g0g1-demo-batches-20260830",
  "action": "send_data_externally",
  "scope": {
    "kind": "data_transfer",
    "value": "29dac843da68e05977294880979f9012502dcfd3601685d9e90d214c5d1942d3",
    "sha256": "5c5a1b35812a281e12cb2818711184bbe15fa0e975492eaf284184151b1f776d"
  },
  "decision": "approved",
  "reviewer": {
    "kind": "human",
    "id": "haochuanzhang"
  },
  "decided_at": "2026-08-30T22:10:49.000Z",
  "expires_at": "2026-08-31T06:10:49.000Z",
  "rationale": "Operator-approved G0/G1 paired demonstration on the vertical slice: tools-based tau-style runs (baseline and after batches) through dsh headless in the demo container with deepseek-v4-flash, fixed prompts, deterministic grader, execution receipts. Scope binds the exact prompt manifest; fault injection is runtime config outside the model-visible scope.",
  "evidence": [
    "repo://benchmarks/tau-style-workflow/run-e2e.ts"
  ],
  "candidate_sha256": null
}
