{
  "$schema": "https://recursive-dev-loop.dev/schemas/approval-decision.v1.schema.json",
  "schema_version": "1.0.0",
  "decision_id": "dec-e2e-run-batch-20260829",
  "request_id": "req-e2e-run-batch-20260829",
  "action": "send_data_externally",
  "scope": {
    "kind": "data_transfer",
    "value": "bc915f72ee4673b88e748aae4bf43a7c5c580dcf1474825549c779112fbc4ee9",
    "sha256": "5ba2a7a56242f0338f42e9271940feaa5dfe7e78066c25b3f6d63f9879aa40d1"
  },
  "decision": "approved",
  "reviewer": {
    "kind": "human",
    "id": "haochuanzhang"
  },
  "decided_at": "2026-08-29T23:28:12.000Z",
  "expires_at": "2026-08-30T05:28:12.000Z",
  "rationale": "Operator-requested closed-loop e2e demonstration on the tau-style benchmark: run batches (baseline and after) of the five synthetic tasks through dsh headless with deepseek-v4-flash, fixed prompts, fixed deterministic grader. Scope binds the exact prompt manifest; no other payload may be sent.",
  "evidence": [
    "repo://benchmarks/tau-style-workflow/run-e2e.ts"
  ],
  "candidate_sha256": null
}
