{
  "$schema": "https://recursive-dev-loop.dev/schemas/approval-decision.v1.schema.json",
  "schema_version": "1.0.0",
  "decision_id": "dec-g1g2-propose-20260830",
  "request_id": "req-g1g2-propose-20260830",
  "action": "send_data_externally",
  "scope": {
    "kind": "data_transfer",
    "value": "915c802b40858edb0ed8bea4aac06093b00fc4c682812f33cc67251dae787ff1",
    "sha256": "b485f0d893e5c853949fe485a2ac97cc9ed6c3229ebaf1033f7a8e729d8d7607"
  },
  "decision": "approved",
  "reviewer": {
    "kind": "human",
    "id": "haochuanzhang"
  },
  "decided_at": "2026-08-31T00:19:27.000Z",
  "expires_at": "2026-08-31T04:19:27.000Z",
  "rationale": "Operator-approved second propose iteration of the G0/G1 demonstration: one deepseek-v4-flash call over the sanitized payload digest 915c802b... targeting the remaining task-004 failure.",
  "evidence": [
    "repo://benchmarks/tau-style-workflow/run-e2e.ts"
  ],
  "candidate_sha256": null
}
