{
  "$schema": "https://recursive-dev-loop.dev/schemas/approval-decision.v1.schema.json",
  "schema_version": "1.0.0",
  "decision_id": "dec-dal-workflow-tools-image-20260901",
  "request_id": "req-dal-workflow-tools-image-20260901",
  "action": "install_or_mount_plugin",
  "scope": {
    "kind": "plugin",
    "value": "install dal-workflow-tools@0.1.0 source-sha256=a026f79e4dc063c0e2e583a2238fc5f10bcf6c854ded05f8e6c9ecc8934ae7e7 into isolated Docker image dsh-adaptive-loop/dsh:0.1.1-rc.2-benchmark-v2 via deploy/docker/Dockerfile; no shared host profile",
    "sha256": "85af710aa467e4a339020be249b522f509e5f95ada5ec201db08939209087d55"
  },
  "decision": "approved",
  "reviewer": {
    "kind": "human",
    "id": "workspace-user"
  },
  "decided_at": "2026-09-01T21:12:23.874Z",
  "expires_at": "2026-09-01T22:12:23.874Z",
  "rationale": "Approve the test-only local plugin installation into the isolated benchmark image. This decision does not authorize a shared host profile, G2 mounting, optimization-candidate application, or external data transfer.",
  "evidence": [
    "repo://deploy/docker/Dockerfile",
    "repo://benchmarks/tau-style-workflow/.dsh/plugins/dal-workflow-tools/package.json"
  ],
  "candidate_sha256": null
}
