{
  "$schema": "https://recursive-dev-loop.dev/schemas/approval-decision.v1.schema.json",
  "schema_version": "1.0.0",
  "decision_id": "dec-g1-passk-20260831",
  "request_id": "req-g1-passk-20260831",
  "action": "send_data_externally",
  "scope": {
    "kind": "data_transfer",
    "value": "ca0fd1920f2590b08021d4c11b9ccee4321f1366efb01a4beb0f2c9f5f82b919",
    "sha256": "28a2089977bd8c41cfc1d4f73080eb7848e9efd78a3b18977bf3d1c52f39d3a8"
  },
  "decision": "approved",
  "reviewer": {
    "kind": "human",
    "id": "haochuanzhang"
  },
  "decided_at": "2026-08-31T02:04:35.000Z",
  "expires_at": "2026-09-03T00:00:00.000Z",
  "rationale": "G1 pass@k leg: deepseek-v4-flash on deepseek-official with the v3 candidate skill, 5 attempts/task, issue_refund=unknown faults. Issued under explicit operator delegation (session 2026-08-31).",
  "evidence": [
    "repo://benchmarks/tau-style-workflow/PROVIDERS.md"
  ],
  "candidate_sha256": null
}
