{
  "$schema": "https://recursive-dev-loop.dev/schemas/approval-decision.v1.schema.json",
  "schema_version": "1.0.0",
  "decision_id": "dec-user-global-remove-20260829",
  "request_id": "req-user-global-remove-20260829",
  "action": "change_shared_harness_config",
  "scope": {
    "kind": "configuration",
    "value": "25c4c9e9434b579d9855d0d67c3ef49225985abb4dc3b0d92a8ceb183cb1bfe9",
    "sha256": "4e3ff18bb11fd28f7012b98f144f4012db24256f347abeea07deb104a0f9362a"
  },
  "decision": "approved",
  "reviewer": {
    "kind": "human",
    "id": "haochuanzhang"
  },
  "decided_at": "2026-08-30T00:29:00.000Z",
  "expires_at": "2026-08-30T02:29:00.000Z",
  "rationale": "Operator-approved removal of the user-global dal install (end-task-feedback skill under ~/.agents/skills and the fixed user-global AGENTS.md under ~/.dsh): host dsh sessions no longer need the loop installed because testing runs through the docker-hosted harness; the scope binds the exact target paths and their current content digests.",
  "evidence": [
    "repo://docs/deployment/user-global-install.md"
  ],
  "candidate_sha256": null
}
