{
  "$schema": "https://recursive-dev-loop.dev/schemas/approval-decision.v1.schema.json",
  "schema_version": "1.0.0",
  "decision_id": "dec-g0g1-propose-20260830",
  "request_id": "req-g0g1-propose-20260830",
  "action": "send_data_externally",
  "scope": {
    "kind": "data_transfer",
    "value": "7825fc6ee11f11b9051263e63171304d3833b955318346bfb30c0ccb11ec5c8a",
    "sha256": "1d607ad6c6c22bcdedff26350aed19020f8b4c125785322a85657d4a12cb67ce"
  },
  "decision": "approved",
  "reviewer": {
    "kind": "human",
    "id": "haochuanzhang"
  },
  "decided_at": "2026-08-30T22:26:58.000Z",
  "expires_at": "2026-08-31T02:26:58.000Z",
  "rationale": "Operator-approved governed proposer call for the G0/G1 demonstration: one deepseek-v4-flash call over the sanitized payload digest 7825fc6e... (cluster fingerprints and capped summaries only).",
  "evidence": [
    "repo://benchmarks/tau-style-workflow/run-e2e.ts"
  ],
  "candidate_sha256": null
}
