{
  "$schema": "https://recursive-dev-loop.dev/schemas/approval-decision.v1.schema.json",
  "schema_version": "1.0.0",
  "decision_id": "dec-moonshotai-passk-20260831",
  "request_id": "req-moonshotai-passk-20260831",
  "action": "send_data_externally",
  "scope": {
    "kind": "data_transfer",
    "value": "0f097341df6d5a8a0c1b1523d9590fab88d9de4f90ebe08f4c1ab3ef0aff7e98",
    "sha256": "8062b5ecdb50b4d78229741770d9c1030ccfbcecb8765030cefa1e071898553c"
  },
  "decision": "approved",
  "reviewer": {
    "kind": "human",
    "id": "haochuanzhang"
  },
  "decided_at": "2026-08-31T02:14:45.000Z",
  "expires_at": "2026-09-03T00:00:00.000Z",
  "rationale": "Provider matrix: moonshotai/kimi-k3 with the v3 candidate skill and issue_refund=unknown faults. Issued under explicit operator delegation (session 2026-08-31).",
  "evidence": [
    "repo://benchmarks/tau-style-workflow/PROVIDERS.md"
  ],
  "candidate_sha256": null
}
